ID,STATE,KEYWORD TYPE,KEYWORD,TITLE,TEXT,UTC
124,Kansas,IDENTIFIER-WEATHER-ATTITUDE,"weather, storm, hate",[KS] Rental Lease Issue Concerning Possible Unsafe House,"


I am renting a house from a private homeowner through a Property Management company. It has been discovered that a basement wall is collapsing, and it was discovered because of a water leak I found during a storm. The contractor that came to look said it appears they tried to patch the leak several times before, but because the foundation of the house is shifted so badly, water will get in during any storm that’s bad enough. The wall is against the backyard, and to fix the wall they would need to excavate the backyard and replace the limestone currently there with the appropriate material. During my 6-month walkthrough, the Prop. Management employee said they are discussing with the homeowner terminating the lease, since he is not wanting to pay the $30,000 to fix this wall. 

With that being said, I began looking for another place to rent and told her I was going to move. Last week, I went to finalize the plan for this, and she informed the homeowner does not want to break the lease, he would rather explore the option of installing a pump to get water out of the basement. The first of several issues is; there is no actual water in the basement outside of inclement weather, and even then it is 3 fairly small leaks in the basement, one around the water heater, one in the corner of the collapsing wall, and one on a wall with drywall. The pump would not fix the wall, or the shifting foundation that has caused a myriad of issues including warped floors and a back door that does not stay shut unless I force the deadbolt to secure it. I brought up to the employee that I am looking in Kansas City for housing since this house is not a viable option and I have not been able to find housing closer to where I live now. She informed me the lease includes a clause that states in order for me to move out before my lease ends, I would need to pay a $500 early vacate fee and be responsible for rent and utilities until someone else rents the home or my lease ends, in March 2025. 

The question I have is, do the above issues qualify this house to be unsafe? The basement windows cannot shut because of the wall being pushed in by the yard, and the door will open with the slightest breeze if the deadbolt is not secured. (I have submitted maintenance work for the door three months ago and they did not fix the issue) If it does make this house unsafe, would that open the door to me being able to get out of this lease without being responsible for two separate rents? I cannot find a house in my city that is pet friendly, and in KC I can, along with jobs in my career. Please let me know if I have left out any relevant information, I have not encountered an issue like this before and want to know my legal options before I meet with the Property Management company on 10/16.",2024-10-10 03:29:17+00:00
125,Kansas,IDENTIFIER-WEATHER-ATTITUDE,"weather, storm, hate","Towns of the Grand and Overlooked State of Kansas, 5x5",,2023-09-26 18:59:14+00:00
126,Kansas,IDENTIFIER-WEATHER-ATTITUDE,"weather, storm, hate",Looking for Evergy users who lost power in July and January,"Hello everyone. I hope this is allowed:

I'm a journalist for the Kansas News Service and KCUR (public radio). I'm looking for people to interview for a story on losing power during severe weather in July and January. I know some lost power for days in July after the massive wind storm knocked down trees. Did anyone who lost power then also lose power in January?

If anyone is willing to share their experiences with me for a radio news story, I would love to hear them. You can message me here or send me an email at [dlysen@kcur.org](mailto:dlysen@kcur.org).

Thanks!

&#x200B;",2024-01-22 16:30:05+00:00
127,Kansas,IDENTIFIER-WEATHER-ATTITUDE,"weather, storm, hate",Riding the school bus to Vinland Kansas in the '60's,"We moved from Baldwin Kansas sometime during 1965 to a very rural area a few miles outside Vinland and it was culture shock right away. We'd always lived in small towns, Olathe, Gardner (twice), and then Baldwin and while I wasn't a big fan of school I did like living in Baldwin. It had everything you needed. A theater, college kids going to Baker, and actual college dorms scattered around town. During that summer I played in little league (Cardinals) and actually had to try out in those days to make the team. But then my world took a hit when we moved to a small 1/2 acre cut into the hillside. I can still see that red dirt and taste that rusty well water.   

Then came school at Vinland junior high for the 6th grade (we had junior high for 6, 7, and 8 there). The school was ancient but they had added on a more modern building for grades 1-5 and that part still lives I believe while the old building is gone. And I don't believe it's a school anymore. As it turned out life was even better for a kid there as we had 13 kids in our class and everyone was friendly. But the downside was riding the bus 2 hours a day, an hour in the morning, and an hour at night mainly because we were first on in the morning and last off at night.

If you have ever ridden on a bus on country roads it's like riding a rollercoaster up and down the rolling hills of eastern Kansas complete with enough ruts, bumps, and drops to shake your brain loose. I spent most of my time trying to read science fiction books while dealing with motion sickness but in the end, my need to read got me past the sick stomach. That two hours a day was a life in itself as we wound our way through tree-covered narrow gravel country roads where we often clipped through overhanging branches if we had to make room for a passing car, tractor, or combine on its way to a field somewhere. 

And it wasn't a slow trip as those bus drivers (often college students) drove like the wind ""bullseye"". We got tossed all over, bounce up and down constantly the entire trip, and since there were no seat belts you could if you were careful end up in the aisle and on your backside often with the driver's face in his large mirror looking back at us with a grin on his face.

Sometimes the gravel dust would come in through the always-open windows and try to choke us all to death when vehicles passed by. The only break we go was when the bus stopped to drop or pick someone up. So you had to catch your breath quickly. The nightly trips were different as everyone was more relaxed and talkative. The girls often sang songs for most of that hour, Henry the 8th I Am was a favorite and most of us boys would groan as they started up yet another round of Henry over and over and ...well. Nevermind. You get the drift. My sister, who was 18 months younger, and her friend Cheryl often led the singing which I would try to ignore except to look up to catch a peek at her best friend sitting with her. Someone I had a crush on for 3 years and never once did I ever let on how I felt. (still hurts a bit sometimes).

The weather often made the trips even more treacherous with mud and snow and we seldom missed a day of school too. It usually took an ice storm to keep us home from school. We boys did have some fun usually towards the end of the run as the bus emptied out we'd sit in the furthest back seats and then slide into the aisle where we'd stand and ""surf"" the bus and its wilding changing angles over hills and bumps. Sometimes we'd catch the driver watching us but he usually didn't say anything when we did it. My friend Tim (Chanay) and I talked about joining the air force and becoming fighter pilots one day. His dad flew crop dusters out of the Vinland Aerodrome.

While it could get exciting moving over into the overhanging tree limbs at breakneck speed at times for the most part we were never really in any danger except one day, one very cold and icy day a broken limb off a tree (apparently had broke due to the ice on the three and was just sitting on top of other branches while it waited for us to pass buy. A pickup truck forced the driver over and with a crash, that limb came through the front windshield and penetrated the bus at least 10 feet back into the seating area. It came within a foot of a little girl sitting ahead of us. Luckily, no one was seriously hurt as the bus was half empty at the time.

The only other thing that I remember happening was when a senior from the high school, one of the few that ever rode the bus, thought it funny to pull the cord on my jacket after he apparently looped it around my neck tight. I immediately started choking and my vision went black until the next thing I remember the driver was dragging the kid off the bus by the arm and escorted him off where he left him standing. We quickly came to another immediate stop as the driver lept off the bus and went running back towards the kid (who fully matched the driver in height) and started yelling at him. The kid had thrown a rock at the bus as we started to leave and that college kid wasted no time dealing with him. 

Besides those two incidents, it was just endless hills and bumps and roller coaster drops as we'd run over rattlesnakes crossing the road or rabbits and dogs dodging the bus as we passed by endless farmland nestled into surrounding timber forests. This went on for 3 years until I started going into Baldwin my ninth grade year for high school and not long after I started riding with friends in their cars and pickups into school. One was named Allan who had his 46 ford pickup he was so proud of. A truck without a working starter so he'd always park so we could push it and get it started by popping the clutch to get the engine going.

We moved away after my sophomore year and to this day I miss that school at Vinland and the new high school in Baldwin that opened my freshman year. That was the first school I ever experienced air conditioning since we never had it at home and in school until then.

&#x200B;

Mike Young. Now living in Paola Ks. Thanks for reading.

&#x200B;",2023-07-02 19:58:36+00:00
128,Kansas,IDENTIFIER-WEATHER-ATTITUDE,"weather, storm, hate",I’ve got Spring and 78° in the final.,,2023-03-15 22:08:19+00:00
129,Kansas,IDENTIFIER-WEATHER-ATTITUDE,"weather, storm, hate",In KC we have the Toganoxie split,,2023-03-30 22:31:00+00:00
130,Kansas,IDENTIFIER-WEATHER-ATTITUDE,"weather, storm, enjoy",Day 11-13 of Walking Across Kansas (Walking Across America),"Howdy Y’all,

Currently writing to you from the wonderful town of Washington, KS. I was able to make it here in 3 days from Smith Center after I took a rest day to get over my little illness. Felt much better after taking a day to recover. 

The day I left off from Smith Center didn’t get off to a great start when I locked myself out of my hotel room in order to go stretch. The Innkeeper of the Buckshot Inn was up in Nebraska getting Chemo, so there wasn’t a way to get back in. She told me to try and pick the lock, which was much easier said than done with a Casey’s gift card. Eventually a guy she called came to come replace the lock. If you are ever in Smith Center please go visit the Buckshot Inn the people there are really nice and gave me 2 nights for $19, and I’m sure that they would appreciate the business. 

After the delay, I headed to Mankato. Along the way I got to pass the geographic center of the US which was pretty neat. Kansas is really at the center of the country (at least the lower 48). Eventually I made it to Mankato and I’m sure some of you are familiar with Mankato because the YouTube channel “Yes Theory” threw a Party in “the most boring town in America” there. It was kind of funny because I didn’t know what “Yes Theory” was until I got to Mankato. Nice town though.

On Thursday the goal was to get to Belleville. Easier said than done with a headwind. After I passed Scandia, the clouds started to look ominous so I was looking for a way to get off 36 when the storm rolled in. As soon as I got off it started raining and I quickly made my way to a barn. There I took shelter with Farmer John and his dog Mav. I had a nice time talking with Farmer John about the harvest and how much all of his farm equipment cost. After the rain I set out and Mav really wanted to come walking across Kansas with me. Farmer John had to come get him a couple of times. He had also warned me about the mud, which I thought I could push through. I couldn’t. So I had to trudge my way back to 36. Once I got back on there I made my way to Belleville.

Then finally yesterday the goal was to get to Washington. Which was a place that I was really looking forward to because the goal of my walk is to get from Washington state to Washington DC, so it was fun to stop at a Washington in the middle. Because of a hefty tail wind I was able to do about 33 miles in about 5 hours. The ancient midwestern proverb of “it wouldn’t be so cold/bad without the wind” was in full effect today. I even heard some people say it in Belleville. As such instead of pitching my tent at the campground, I decided to pitch my tent in the warm and spacious shower room at the campground. Not as bad as it sounds. Unfortunately I forgot to lock the door last night, so at around 11:30 last night, a guy comes in to take a shower and it scared the bejezzes out of me. His water heater had broke and he was a nice guy so not terrible, but definitely locked the door after that. 

Plan for today is to get to Marysville. Its looking like I’ll probably be able to finish Kansas on October 18th. Sorry to people on here who wanted me to come to Manhattan, Lawrence and Topeka but I gotta make it to St Joe to see my grandparents and cant delay with the weather getting colder. Because some people on here said I could walk across 36 into St Joseph, I reached out to their police department and they said I could and that they would even help me cross. So that’ll save me some time.

Other than that im still enjoying my time in Kansas and meeting lots of great people. As always the best place to follow my journey is on IG at walk2washington or at my website of the same name.

Additional thoughts:

1. A lot more trees: I have definitely noticed a decent amount more trees as I’ve gotten farther East. It is appreciated and im enjoying seeing the tinges of yellow. 

2. Towns that play music: IDk if this is a Kansas thing but this didn’t happen in any of the other states that I’ve walked through, but a lot of the towns play music out loud in their downtowns. It is  not bad, but it is kinda eerie when downtown is empty.

3. Windmills: I didn’t see any wind farms until I got to Belleville. For such a windy state I really expected there to be more. Especially since the land can still be used for farming and ranching. 

4. No breakfast spots: I often go to Mexican restaurants when I go to town for lunch or dinner because there is usually one in a town. But since I start most days in a town, I would love to get a hot breakfast;however, so many towns that I pass through don’t really have a spot or the spot is really inconvenient. 

5. Shrinking towns: Whenever I pass through a town I always check the Wikipedia page for info. Something I’ve noticed in most of the towns and counties that I’ve passed through though is that populations seem to be shrinking. I’ve also seen that school closures have been an issue in this area too. Im sure there are parts of Kansas that are growing, but are these trends common in other parts of the state?",2023-10-14 13:59:11+00:00
131,Kansas,IDENTIFIER-WEATHER-ATTITUDE,"weather, storm, enjoy",Day 4-6 walking across Kansas (Walking Across America),"Howdy y’all,

So I’ve made it from McDonald, KS to Prairie Dog State Park just outside of Norton, KS. I have definitely been covering some good distance and it is probably for the best since the weather is beginning to change, this morning was the first at around freezing since March, so this boy is a moving and a shaking to head East and then South.

I thought I’d share some highlights and thoughts from the last couple of days in no specific order. 

Campgrounds: One of the biggest surprises for me has been the abundance of free public campgrounds along 36. As long as I make it to a town I have reliable spot to sleep, which has been the case every night so far. Public land was much more readily available in the Western states I traversed, so I was a tad worried for Kansas, but the campgrounds have been such a blessing. I’m currently at Prairie Dog State Park and a fun fact about the park is that Prairie Dogs didn’t actually live here until the 1980s even though the park was started in 1967.

Trucks getting over: I walk by lots of big trucks and 18 wheelers along my journey. Maybe surprisingly to some, but 18 wheeler drivers are probably the most courteous to me, in Kansas especially. They will either slow down or get over to the complete other lane for me which is really appreciated. I think I’ve probably seen the same drivers multiple times, but if they are reading this, thank you so much.

Corn: I think a lot of what the drivers are hauling is corn as I am seeing it everywhere. I expected to see plenty of it in the Midwest, but there still is just so much. One of the big things I was interested in learning about out West was water. But in Western KS I imagine a lot of this corn is being fed by the Ogallala Aquifer. I’d also imagine that this is a finite water supply, so is/are there any good journalism or resources to learn more about the aquifer and issues surrounding it? 

Oberlin: I really enjoyed the aesthetic of Oberlin with its brick roads, covered walkways, and historic buildings. Didn’t spend too much time there, but it was a cool place to check out and walk around for sure. 

County museums: When I was in Atwood I was able to go to the Rawlins county museum which every time I go to a town’s museum I always find out something interesting. For example Rawlins county is home to the guy who popularized Smokey Bear (apparently not Smokey the Bear). It is the longest running PSA in American history. Additionally there was a real life Smokey Bear that was rescued from a fire in New Mexico and brought to the National Zoo in DC. I had a great time talking to Lynette, who oversaw the museum, too. Don’t sleep on the little inconspicuous museums, you can always learn something there. 

Burrs, stickers, thorns: I wish I had known about these before coming to KS, because they have done a number on my tires. I was able to get some slime in Oberlin, but I am looking forward to the day when they aren’t a problem. Anyone know where they stop being an issue East of here? 

Tanner’s dad: Lastly on my 30+ mile day to Oberlin, a man pulls his car over a little bit in front of me and goes to his trunk to get something. As I approach the car the man is carrying two water bottles and offers them to me. We get to chatting and he tells me that he is Tanner’s dad, sweet guy from my first day in KS. I believe they are the Lacy’s and they are absolutely the sweetest family around. If you need some drywall work done in NW KS there is no one I’d recommend more highly than them.

This has probably run too long, but hope y’all enjoyed and it’s definitely better than not having anything to say about a place. I’ve really enjoyed my time in KS so far and have met so many friendly people already. Looking forward to much more. As always the best place to follow my journey through your great state is on IG at walk2washington.",2023-10-07 14:05:13+00:00
132,Kansas,IDENTIFIER-WEATHER-ATTITUDE,"weather, storm, enjoy",How is everything so cheap here? Wichita,"I’m in Wichita for business and I feel like I went back in time to the late 90s.

Everything is so cheap compared to California. Even restaurants are cheap. I can’t even get a mediocre sandwich where I live for less than $15.

I can see a lot of the town is not great but I’m confused as to how there can be such a massive difference in costs here vs California? A lot of houses are the prices of nice cars. 

I honestly feel like I’m in a time warp or a different country.

The weather is horrific here right now though. I would rather pay a crazy amount for a house and be able to enjoy the outdoors every day, so I’m guessing that’s a big part of it.",2023-08-25 22:34:23+00:00
133,Kansas,IDENTIFIER-WEATHER-ATTITUDE,"weather, storm, enjoy",Storm Watch for Wednesday!!,Please be weather aware tomorrow 🙏 ,2024-10-30 04:46:59+00:00
134,Kansas,IDENTIFIER-WEATHER-ATTITUDE,"weather, storm, enjoy",Day 3 Walking across Kansas (Walking Across America),"Not sure how frequently I will do these, but it seemed like in my last post people were interested in seeing what was happening along my journey. Yesterday seemed like a great day to highlight.

Started off the day from St Francis after a rest day and there was plenty of thunder to the West, but when I checked the radar I thought it would miss me (classic mistake).

I pretty much ran the whole way to Bird City with no rain up until that point. As soon as I got there a nice stranger named Alex saw me and came to hand me some water bottles. She was having to pretty much run after me because my walking speed was so fast lol. Very thankful for her.

The clouds were getting a little more ominous as I left Bird City, but the weather wasn’t saying any rain. So I kept walking until I felt some raindrops. Then the thunder started and there wasn’t really anywhere to take shelter. So I ended up sprinting to a dairy farm where i was able to shelter from the rain, lightning and hail in their office.

Once that cleared up, I set off again and thought the rain would be over for the day (wrong). I took some farm roads that had no traffic. I was heading to McDonald, KS when I checked the weather and it said I had 30 mins before the thunderstorm started up again. So we hauled ass through the corn fields to get to McDonald where I took shelter in a grocery store.

After that the rain was all done and I decided to pitch my tent at a rest stop off 36. It was here that maybe the most wild thing of the day happened. I called my grandparents in St Joseph to talk about a completely random matter and I mention to my pop pop that I was in McDonald. He then just casually mentions that my grandmother’s family had actually helped start the town back in the late 1800’s. Don’t think any of the family is still here, but this town that I had never heard of until yesterday was actually help started by my family and it was a complete coincidence that I called my grandparents on that exact day to learn that. Just wild to me.

Hope you all enjoyed reading this. I will probably make it to Atwood today so if anyone knows anyone there who could help me out give me a holler. Otherwise the best place to follow my journey through your great state is on IG at walk2washington.",2023-10-04 13:01:54+00:00
135,Kansas,IDENTIFIER-WEATHER-ATTITUDE,"weather, storm, enjoy",My 'what do you miss about Kansas' post as a chart,"A few weeks ago I made a post asking people what they missed about Kansas. I got hundreds of replies. Thanks!

I tallied (roughly) everything that was mentioned in the comments and made this completely unscientific chart. I thought the number one spot would be taken by storms or BBQ, but it turned out to be people. Which is kind of nice.

https://preview.redd.it/4gsgdyb0cfnc1.png?width=1458&format=png&auto=webp&s=95a8808c202bb2961a1c511d1bfa49e45c95fed0",2024-03-10 03:16:41+00:00
