ID,STATE,KEYWORD TYPE,KEYWORD,TITLE,TEXT,UTC
463,Kentucky,IDENTIFIER-WEATHER-ATTITUDE,"weather, rain, comfortable",Warm Weather (for January) Through Mid-Month,"Warmer than normal weather looks to continue through the middle of the month. Some snow chances may be possible during this time, however. Thursday night into early Friday may yield some rain and snow showers for parts of eastern and northeastern Kentucky. 

Another system will push through this weekend. Mostly rain is expected, but a wintry mix or some snow can’t be completely ruled out. This is especially true for northern and northeastern Kentucky.",2023-01-04 18:29:32+00:00
464,Kentucky,IDENTIFIER-WEATHER-ATTITUDE,"weather, rain, comfortable",‼️Strong to Severe Storms and Dangerous Heat‼️,"Some strong to severe storms are looking possible to end the workweek ahead.  As a ridge builds to our southwest, our trough will shift slightly northeast.  This will allow heat to build in our area.  Some parts of western Kentucky could hit 100 multiple days by the end of this week.  There is already an Excessive Heat Watch out for western KY.  With this ridge, shortwaves look to ride over the state from the northwest.  This will increase our shower and storm chances.

The Storm Prediction Center is already highlighting parts of the state in a low-end severe storm threat by Thursday.  I think we will have another threat on Friday and maybe even Saturday.  This is definitely something to watch.  I think with these types of systems, damaging winds will be the main threat.  Heavy rain and lightning will also be possible.

Visit:
https://www.ekyrrgweather.com",2023-06-27 18:58:30+00:00
465,Kentucky,IDENTIFIER-WEATHER-ATTITUDE,"weather, storm, love","Uh Kentucky, are you going to be ok???",,2024-09-27 17:03:56+00:00
466,Kentucky,IDENTIFIER-WEATHER-ATTITUDE,"weather, storm, love",A Few Strong Sunday Storms for Kentucky- Bluegrass Weather Report- 4/15/...,,2023-04-15 22:35:22+00:00
467,Kentucky,IDENTIFIER-WEATHER-ATTITUDE,"weather, storm, love",The #kentucky #weather #forecast calls for #storms to return on Thursday.,,2023-04-27 02:14:13+00:00
468,Kentucky,IDENTIFIER-WEATHER-ATTITUDE,"weather, storm, love",Any states around (or any places in) Kentucky worth visiting around late December with a partner?,"I’m visiting my Boyfriend for Christmas but we decided to go travel together around Kentucky(the states around it), he’s the go with the flow type of guy and wants to just plan it when time comes but I love making itineraries and figuring out the plans before hand.do you think y’all could tell me what places (preferably around or in Kentucky) that you visited with a partner in cold weather that’s worth visiting? I’ll be out there for about 10 days so 4-5 days will be spend out of Kentucky. If you do take the time to comment I would appreciate that a bunch!! Thank you ",2024-11-14 12:49:45+00:00
469,Kentucky,IDENTIFIER-WEATHER-ATTITUDE,"weather, storm, love","In your opinion, what are the most defining characteristics of Lexington’s culture?","So me and a friend of mine are writing and recording an album of songs all about Kentucky (ala Sufjan Stevens), and naturally we wanted to write a song with Lexington being the main focus of the lyrics.

I’ve been to Lexington plenty of times in my life, but I’ve never lived there and never really explored it’s nooks and crannies and the things that make this city especially unique.

So I’m crowd sourcing some intel, what in your opinion are some aspects about Lexington and its culture that stand out to you the most?",2023-02-07 14:52:16+00:00
470,Kentucky,IDENTIFIER-WEATHER-ATTITUDE,"weather, storm, love",Looking to move to Kentucky. Would love some real life info on some places.,"So to make a very long story short (will try to be organized) in the next couple years my mother and I and possibly my brother are looking at selling both our houses in upstate NY (god I hate it here) and moving to Kentucky.

We have looked into a lot of info to pick a state and are pretty set on Kentucky for a number of reasons. That being said we have never moved out of state or looked and it's a bit hard online to sort the reality & truth from the bs and pomp.

I will try to highlight some keypoints of what we are looking for but would appreciate ANY help in narrowing down good cities to look into or just as importantly good cities to AVOID.

&#x200B;

* We are looking for suburbs. This is pretty important. We like our own space and while we don't want full blown country with the nearest hospital or store being an hour away we would like to avoid a street with house after house on top of each other.  Suburbs with a 10-20 minute city away would be great. Would like businesses/stores/doctors/fast food places/jobs etc within a realistic distance away.
* Weather I would assume is mostly the same in most of the state. We enjoy all 4 seasons but living currently near buffalo we are so done with snow storms that give us literally feet of lake effect snow. On the flip side not a huge fan of super hot and humid. I know most of kentucky seems to be rather warm especially during summer months but this is expected just don't want super humid on top of it.
* Good neighborhood/city is vitally important. While Kentucky seems to have great reviews for the state as whole.... I don't know how to explicitly find info of places to avoid with bad neighborhoods or high crime rate.  If anyone knows NY at all up here we live in a pretty nice low crime no issues city but there are a couple cities within like 20-30 minutes from us that are pretty terrible places. Very low class, higher crime, bad neighborhood type stuff (Buffalo and Niagara Falls though they both have better parts and worse parts).  We are comparably NOT looking for something similar to whatever city we end up moving too.
* Decent cost of living + house price. We are far from being wealthy but do have 2 houses we will be selling to give us some money as well. Looking somewhere in the neighborhood of like $200k-300k for a nice decent size house.  Maybe even a bit more as needed or ofc less would be fine. We are NOT looking for a fixer upper or a ""dump"" that needs a ton of work. Probably something  like 2-3 bedrooms 2-3 bathrooms. Does not need to have a huge yard or a ton of land (actually don't want a  TON of land).
* Amenities and attractions and such don't matter very much. We both spend the majority of our time in house or in yard and don't ever really go out much besides for normal shopping and such. Not saying there can't be cool things to do out there but not really a huge selling point for where we looking to move.

Anyway thought I would ask reddit because it's such good source of factual info. Any help would be appreciated. Probably won't be moving for 2-3 years but would like to start narrowing things down and at least finding a good area to look in.  Any help from anyone out there who has a nice area or has visited a nice area or any info at all would be awesome.

Thanks in advance!! 

&#x200B;",2024-07-16 23:35:20+00:00
471,Kentucky,IDENTIFIER-WEATHER-ATTITUDE,"weather, storm, love",Camping North of Lexington ,"Hey everyone, I'm planning on heading down tomorrow to camp for the week at Three Springs Campground north of Lexington with another couple (coming from SW Michigan). Looking at the weather forecast we're debating on waiting until Monday to come down....I'm typically a ""it shouldn't be bad, let's go for it"" person, but it's a long way from home for something to happen. What is everyone's thoughts on the forecast? Does that area see a lot of flooding during big storms? Any help or advice is appreciated!",2024-05-24 20:58:37+00:00
472,Kentucky,IDENTIFIER-WEATHER-ATTITUDE,"weather, storm, love",‼️Severe Storms Look Likely Today‼️,"Happy Sunday everyone!  Strong to severe storms will be possible again today before we look to get a break by tomorrow. The Storm Prediction Center has upgraded most of the state to an Enhanced Risk (3/5) in their latest outlook. 

Some showers and storms moved across the state early this morning, but some clearing is taking place now. This will allow for some destabilization and help storms to form later this afternoon and evening. Damaging winds will be the main threat!

Make sure to visit ekyrrgweather.com!",2023-07-02 17:44:47+00:00
473,Kentucky,IDENTIFIER-WEATHER-ATTITUDE,"weather, storm, love",Severe Risk Continues Today,"Our severe threat continues today but was scaled back slightly for some in the latest update by the SPC.  Damaging winds, hail, and a few tornadoes still look possible. A Flood Watch is also out for much of the state as heavy rain will continue as these storms push through.  Remain alert!",2023-02-16 14:53:37+00:00
474,Kentucky,IDENTIFIER-WEATHER-ATTITUDE,"weather, storm, love",Severe Threat Increasing For The State,"The severe threat has been upgraded by the SPC to an enhanced risk (3/5) for much of the state for tomorrow. Damaging winds, hail, a few tornadoes remain possible. One round looks possible overnight tonight and another tomorrow morning and afternoon! Remain alert!",2023-02-15 15:07:47+00:00
475,Kentucky,IDENTIFIER-WEATHER-ATTITUDE,"weather, storm, love",Wild weather,"Crazy storm front just moved through here (Benton). Sirens going off in town, trees whipping around like grass. Definitely Tornado weather. Can't believe I still have power!

Stay safe, everyone!",2023-07-02 00:05:46+00:00
476,Kentucky,IDENTIFIER-WEATHER-ATTITUDE,"weather, storm, love",‼️Severe Weather Update-Sunday‼️,"Parts of the state have been upgraded to an Enhanced Risk (3/5) for tomorrow as of the afternoon update from the Storm Prediction Center. Damaging winds appear to be the main threat. A few tornadoes and hail will also be possible. The greatest tornado threat appears to be across central, northern, and western Kentucky. We look to have one round early in the day, but the severe storms look to come during the night. Make sure to remain alert! https://www.ekyrrgweather.com",2023-06-25 01:10:50+00:00
477,Kentucky,IDENTIFIER-WEATHER-ATTITUDE,"weather, storm, love",Lexington,"Hey everyone.  My wife & I are debating moving to the Lexington area in early 2024. We both work in healthcare & currently live in Maryland. 

We have visited Louisville a few times for the bourbon trail, but only a few days at a time. 

Can you guys give me some pros & cons of living in Lexington? We are coming to Lex in October to see how we enjoy the city. Any advice would be great.",2023-07-04 19:35:45+00:00
478,Kentucky,IDENTIFIER-WEATHER-ATTITUDE,"weather, storm, love",‼️Severe Storms Possible Sunday‼️,"‼️Severe Storms Possible Sunday‼️

As a cold front approaches the area on Sunday, strong to severe storms look to spawn and move into the area. These look to form earlier in the day across western parts of the region and move through into the overnight. Damaging winds, hail, and a few tornadoes all look possible. Make sure to monitor forecasts and share!",2023-06-23 20:14:57+00:00
479,Kentucky,IDENTIFIER-WEATHER-ATTITUDE,"weather, storm, love",❗️Severe Storms Possible The Next Three Days❗️,"https://preview.redd.it/iq59398m7z8b1.png?width=1007&format=png&auto=webp&s=6c21f91b0ac08cf3e1f526c8b45d0a2cdf3e3d69

Happy Thursday, everyone!  All eyes are on our severe storm threat over the next three days as rounds of showers and storms look to ride along the edge of a building ridge.  This morning a complex of strong to severe storms is pushing across parts of western Kentucky.  Damaging winds have been the main threat thus far.

Later this evening, another round of storms looks to roll across the state.  The location of this round is still in question.  The latest hi-res models are showing this cluster all over the place.  The newest HRRR run shows this impacting more of central and eastern Kentucky but weakening as it pushes into the state. This is definitely something to watch for most of the region.  

More rounds of strong to severe storms look possible Friday and Saturday, and the focus of these rounds should shift to the northeast of our round so far today.  Each MCS's timings, location, and severity are still in question.  Uncertainty is high because of the difficulty of forecasting these Mesoscale Convective Systems (MCS's) riding along the edge of a ridge.

 [https://www.ekyrrgweather.com](https://www.ekyrrgweather.com/?fbclid=IwAR3rs_Y-ZSQn1XZfHElnqVGpppgVMWfbU4M_5JAhPjlQ62LVMQqf7YWMiVc)",2023-06-29 15:33:15+00:00
480,Kentucky,IDENTIFIER-WEATHER-ATTITUDE,"weather, storm, love",Severe Storms Possible Tomorrow,"Severe storms will be possible for the entire state tomorrow. Isolated tornadoes and damaging winds look probable. The greatest threat will come during the afternoon. Remain alert!

https://preview.redd.it/4bwr9h654ela1.png?width=1007&format=png&auto=webp&s=fb5757cbf6fefba0ca825749f56913178bbec620",2023-03-02 21:01:21+00:00
481,Kentucky,IDENTIFIER-WEATHER-ATTITUDE,"weather, storm, love",Central Kentucky Weather,"Storms coming from the West look to merge close to Harrodsburg, KY. Chances are favorable for very strong storms in that vecinity and looking eastward. Be weather aware.

https://preview.redd.it/02fmk9jjum9b1.jpg?width=1180&format=pjpg&auto=webp&s=f564363598f5390343c980f9d1d4993130bd6a77",2023-07-02 22:54:43+00:00
482,Kentucky,IDENTIFIER-WEATHER-ATTITUDE,"weather, storm, love",‼️Strong to Severe Storms and Dangerous Heat‼️,"Some strong to severe storms are looking possible to end the workweek ahead.  As a ridge builds to our southwest, our trough will shift slightly northeast.  This will allow heat to build in our area.  Some parts of western Kentucky could hit 100 multiple days by the end of this week.  There is already an Excessive Heat Watch out for western KY.  With this ridge, shortwaves look to ride over the state from the northwest.  This will increase our shower and storm chances.

The Storm Prediction Center is already highlighting parts of the state in a low-end severe storm threat by Thursday.  I think we will have another threat on Friday and maybe even Saturday.  This is definitely something to watch.  I think with these types of systems, damaging winds will be the main threat.  Heavy rain and lightning will also be possible.

Visit:
https://www.ekyrrgweather.com",2023-06-27 18:58:30+00:00
483,Kentucky,IDENTIFIER-WEATHER-ATTITUDE,"weather, storm, hate",Looking to move to Kentucky. Would love some real life info on some places.,"So to make a very long story short (will try to be organized) in the next couple years my mother and I and possibly my brother are looking at selling both our houses in upstate NY (god I hate it here) and moving to Kentucky.

We have looked into a lot of info to pick a state and are pretty set on Kentucky for a number of reasons. That being said we have never moved out of state or looked and it's a bit hard online to sort the reality & truth from the bs and pomp.

I will try to highlight some keypoints of what we are looking for but would appreciate ANY help in narrowing down good cities to look into or just as importantly good cities to AVOID.

&#x200B;

* We are looking for suburbs. This is pretty important. We like our own space and while we don't want full blown country with the nearest hospital or store being an hour away we would like to avoid a street with house after house on top of each other.  Suburbs with a 10-20 minute city away would be great. Would like businesses/stores/doctors/fast food places/jobs etc within a realistic distance away.
* Weather I would assume is mostly the same in most of the state. We enjoy all 4 seasons but living currently near buffalo we are so done with snow storms that give us literally feet of lake effect snow. On the flip side not a huge fan of super hot and humid. I know most of kentucky seems to be rather warm especially during summer months but this is expected just don't want super humid on top of it.
* Good neighborhood/city is vitally important. While Kentucky seems to have great reviews for the state as whole.... I don't know how to explicitly find info of places to avoid with bad neighborhoods or high crime rate.  If anyone knows NY at all up here we live in a pretty nice low crime no issues city but there are a couple cities within like 20-30 minutes from us that are pretty terrible places. Very low class, higher crime, bad neighborhood type stuff (Buffalo and Niagara Falls though they both have better parts and worse parts).  We are comparably NOT looking for something similar to whatever city we end up moving too.
* Decent cost of living + house price. We are far from being wealthy but do have 2 houses we will be selling to give us some money as well. Looking somewhere in the neighborhood of like $200k-300k for a nice decent size house.  Maybe even a bit more as needed or ofc less would be fine. We are NOT looking for a fixer upper or a ""dump"" that needs a ton of work. Probably something  like 2-3 bedrooms 2-3 bathrooms. Does not need to have a huge yard or a ton of land (actually don't want a  TON of land).
* Amenities and attractions and such don't matter very much. We both spend the majority of our time in house or in yard and don't ever really go out much besides for normal shopping and such. Not saying there can't be cool things to do out there but not really a huge selling point for where we looking to move.

Anyway thought I would ask reddit because it's such good source of factual info. Any help would be appreciated. Probably won't be moving for 2-3 years but would like to start narrowing things down and at least finding a good area to look in.  Any help from anyone out there who has a nice area or has visited a nice area or any info at all would be awesome.

Thanks in advance!! 

&#x200B;",2024-07-16 23:35:20+00:00
484,Kentucky,IDENTIFIER-WEATHER-ATTITUDE,"weather, storm, hate","Uh Kentucky, are you going to be ok???",,2024-09-27 17:03:56+00:00
485,Kentucky,IDENTIFIER-WEATHER-ATTITUDE,"weather, storm, hate",A Few Strong Sunday Storms for Kentucky- Bluegrass Weather Report- 4/15/...,,2023-04-15 22:35:22+00:00
486,Kentucky,IDENTIFIER-WEATHER-ATTITUDE,"weather, storm, hate",The #kentucky #weather #forecast calls for #storms to return on Thursday.,,2023-04-27 02:14:13+00:00
487,Kentucky,IDENTIFIER-WEATHER-ATTITUDE,"weather, storm, hate",Camping North of Lexington ,"Hey everyone, I'm planning on heading down tomorrow to camp for the week at Three Springs Campground north of Lexington with another couple (coming from SW Michigan). Looking at the weather forecast we're debating on waiting until Monday to come down....I'm typically a ""it shouldn't be bad, let's go for it"" person, but it's a long way from home for something to happen. What is everyone's thoughts on the forecast? Does that area see a lot of flooding during big storms? Any help or advice is appreciated!",2024-05-24 20:58:37+00:00
488,Kentucky,IDENTIFIER-WEATHER-ATTITUDE,"weather, storm, hate",‼️Severe Storms Look Likely Today‼️,"Happy Sunday everyone!  Strong to severe storms will be possible again today before we look to get a break by tomorrow. The Storm Prediction Center has upgraded most of the state to an Enhanced Risk (3/5) in their latest outlook. 

Some showers and storms moved across the state early this morning, but some clearing is taking place now. This will allow for some destabilization and help storms to form later this afternoon and evening. Damaging winds will be the main threat!

Make sure to visit ekyrrgweather.com!",2023-07-02 17:44:47+00:00
489,Kentucky,IDENTIFIER-WEATHER-ATTITUDE,"weather, storm, hate",Severe Risk Continues Today,"Our severe threat continues today but was scaled back slightly for some in the latest update by the SPC.  Damaging winds, hail, and a few tornadoes still look possible. A Flood Watch is also out for much of the state as heavy rain will continue as these storms push through.  Remain alert!",2023-02-16 14:53:37+00:00
490,Kentucky,IDENTIFIER-WEATHER-ATTITUDE,"weather, storm, hate",Severe Threat Increasing For The State,"The severe threat has been upgraded by the SPC to an enhanced risk (3/5) for much of the state for tomorrow. Damaging winds, hail, a few tornadoes remain possible. One round looks possible overnight tonight and another tomorrow morning and afternoon! Remain alert!",2023-02-15 15:07:47+00:00
491,Kentucky,IDENTIFIER-WEATHER-ATTITUDE,"weather, storm, hate",Wild weather,"Crazy storm front just moved through here (Benton). Sirens going off in town, trees whipping around like grass. Definitely Tornado weather. Can't believe I still have power!

Stay safe, everyone!",2023-07-02 00:05:46+00:00
492,Kentucky,IDENTIFIER-WEATHER-ATTITUDE,"weather, storm, hate",‼️Severe Weather Update-Sunday‼️,"Parts of the state have been upgraded to an Enhanced Risk (3/5) for tomorrow as of the afternoon update from the Storm Prediction Center. Damaging winds appear to be the main threat. A few tornadoes and hail will also be possible. The greatest tornado threat appears to be across central, northern, and western Kentucky. We look to have one round early in the day, but the severe storms look to come during the night. Make sure to remain alert! https://www.ekyrrgweather.com",2023-06-25 01:10:50+00:00
493,Kentucky,IDENTIFIER-WEATHER-ATTITUDE,"weather, storm, hate",‼️Severe Storms Possible Sunday‼️,"‼️Severe Storms Possible Sunday‼️

As a cold front approaches the area on Sunday, strong to severe storms look to spawn and move into the area. These look to form earlier in the day across western parts of the region and move through into the overnight. Damaging winds, hail, and a few tornadoes all look possible. Make sure to monitor forecasts and share!",2023-06-23 20:14:57+00:00
494,Kentucky,IDENTIFIER-WEATHER-ATTITUDE,"weather, storm, hate",❗️Severe Storms Possible The Next Three Days❗️,"https://preview.redd.it/iq59398m7z8b1.png?width=1007&format=png&auto=webp&s=6c21f91b0ac08cf3e1f526c8b45d0a2cdf3e3d69

Happy Thursday, everyone!  All eyes are on our severe storm threat over the next three days as rounds of showers and storms look to ride along the edge of a building ridge.  This morning a complex of strong to severe storms is pushing across parts of western Kentucky.  Damaging winds have been the main threat thus far.

Later this evening, another round of storms looks to roll across the state.  The location of this round is still in question.  The latest hi-res models are showing this cluster all over the place.  The newest HRRR run shows this impacting more of central and eastern Kentucky but weakening as it pushes into the state. This is definitely something to watch for most of the region.  

More rounds of strong to severe storms look possible Friday and Saturday, and the focus of these rounds should shift to the northeast of our round so far today.  Each MCS's timings, location, and severity are still in question.  Uncertainty is high because of the difficulty of forecasting these Mesoscale Convective Systems (MCS's) riding along the edge of a ridge.

 [https://www.ekyrrgweather.com](https://www.ekyrrgweather.com/?fbclid=IwAR3rs_Y-ZSQn1XZfHElnqVGpppgVMWfbU4M_5JAhPjlQ62LVMQqf7YWMiVc)",2023-06-29 15:33:15+00:00
495,Kentucky,IDENTIFIER-WEATHER-ATTITUDE,"weather, storm, hate",Severe Storms Possible Tomorrow,"Severe storms will be possible for the entire state tomorrow. Isolated tornadoes and damaging winds look probable. The greatest threat will come during the afternoon. Remain alert!

https://preview.redd.it/4bwr9h654ela1.png?width=1007&format=png&auto=webp&s=fb5757cbf6fefba0ca825749f56913178bbec620",2023-03-02 21:01:21+00:00
496,Kentucky,IDENTIFIER-WEATHER-ATTITUDE,"weather, storm, hate",Central Kentucky Weather,"Storms coming from the West look to merge close to Harrodsburg, KY. Chances are favorable for very strong storms in that vecinity and looking eastward. Be weather aware.

https://preview.redd.it/02fmk9jjum9b1.jpg?width=1180&format=pjpg&auto=webp&s=f564363598f5390343c980f9d1d4993130bd6a77",2023-07-02 22:54:43+00:00
497,Kentucky,IDENTIFIER-WEATHER-ATTITUDE,"weather, storm, hate",‼️Strong to Severe Storms and Dangerous Heat‼️,"Some strong to severe storms are looking possible to end the workweek ahead.  As a ridge builds to our southwest, our trough will shift slightly northeast.  This will allow heat to build in our area.  Some parts of western Kentucky could hit 100 multiple days by the end of this week.  There is already an Excessive Heat Watch out for western KY.  With this ridge, shortwaves look to ride over the state from the northwest.  This will increase our shower and storm chances.

The Storm Prediction Center is already highlighting parts of the state in a low-end severe storm threat by Thursday.  I think we will have another threat on Friday and maybe even Saturday.  This is definitely something to watch.  I think with these types of systems, damaging winds will be the main threat.  Heavy rain and lightning will also be possible.

Visit:
https://www.ekyrrgweather.com",2023-06-27 18:58:30+00:00
