ID,STATE,KEYWORD TYPE,KEYWORD,TITLE,TEXT,UTC
229,Kansas,IDENTIFIER-WEATHER-ATTITUDE,"weather, misty, enjoy",Day 4-6 walking across Kansas (Walking Across America),"Howdy y’all,

So I’ve made it from McDonald, KS to Prairie Dog State Park just outside of Norton, KS. I have definitely been covering some good distance and it is probably for the best since the weather is beginning to change, this morning was the first at around freezing since March, so this boy is a moving and a shaking to head East and then South.

I thought I’d share some highlights and thoughts from the last couple of days in no specific order. 

Campgrounds: One of the biggest surprises for me has been the abundance of free public campgrounds along 36. As long as I make it to a town I have reliable spot to sleep, which has been the case every night so far. Public land was much more readily available in the Western states I traversed, so I was a tad worried for Kansas, but the campgrounds have been such a blessing. I’m currently at Prairie Dog State Park and a fun fact about the park is that Prairie Dogs didn’t actually live here until the 1980s even though the park was started in 1967.

Trucks getting over: I walk by lots of big trucks and 18 wheelers along my journey. Maybe surprisingly to some, but 18 wheeler drivers are probably the most courteous to me, in Kansas especially. They will either slow down or get over to the complete other lane for me which is really appreciated. I think I’ve probably seen the same drivers multiple times, but if they are reading this, thank you so much.

Corn: I think a lot of what the drivers are hauling is corn as I am seeing it everywhere. I expected to see plenty of it in the Midwest, but there still is just so much. One of the big things I was interested in learning about out West was water. But in Western KS I imagine a lot of this corn is being fed by the Ogallala Aquifer. I’d also imagine that this is a finite water supply, so is/are there any good journalism or resources to learn more about the aquifer and issues surrounding it? 

Oberlin: I really enjoyed the aesthetic of Oberlin with its brick roads, covered walkways, and historic buildings. Didn’t spend too much time there, but it was a cool place to check out and walk around for sure. 

County museums: When I was in Atwood I was able to go to the Rawlins county museum which every time I go to a town’s museum I always find out something interesting. For example Rawlins county is home to the guy who popularized Smokey Bear (apparently not Smokey the Bear). It is the longest running PSA in American history. Additionally there was a real life Smokey Bear that was rescued from a fire in New Mexico and brought to the National Zoo in DC. I had a great time talking to Lynette, who oversaw the museum, too. Don’t sleep on the little inconspicuous museums, you can always learn something there. 

Burrs, stickers, thorns: I wish I had known about these before coming to KS, because they have done a number on my tires. I was able to get some slime in Oberlin, but I am looking forward to the day when they aren’t a problem. Anyone know where they stop being an issue East of here? 

Tanner’s dad: Lastly on my 30+ mile day to Oberlin, a man pulls his car over a little bit in front of me and goes to his trunk to get something. As I approach the car the man is carrying two water bottles and offers them to me. We get to chatting and he tells me that he is Tanner’s dad, sweet guy from my first day in KS. I believe they are the Lacy’s and they are absolutely the sweetest family around. If you need some drywall work done in NW KS there is no one I’d recommend more highly than them.

This has probably run too long, but hope y’all enjoyed and it’s definitely better than not having anything to say about a place. I’ve really enjoyed my time in KS so far and have met so many friendly people already. Looking forward to much more. As always the best place to follow my journey through your great state is on IG at walk2washington.",2023-10-07 14:05:13+00:00
230,Kansas,IDENTIFIER-WEATHER-ATTITUDE,"weather, misty, enjoy",How is everything so cheap here? Wichita,"I’m in Wichita for business and I feel like I went back in time to the late 90s.

Everything is so cheap compared to California. Even restaurants are cheap. I can’t even get a mediocre sandwich where I live for less than $15.

I can see a lot of the town is not great but I’m confused as to how there can be such a massive difference in costs here vs California? A lot of houses are the prices of nice cars. 

I honestly feel like I’m in a time warp or a different country.

The weather is horrific here right now though. I would rather pay a crazy amount for a house and be able to enjoy the outdoors every day, so I’m guessing that’s a big part of it.",2023-08-25 22:34:23+00:00
231,Kansas,IDENTIFIER-WEATHER-ATTITUDE,"weather, misty, enjoy",Day 11-13 of Walking Across Kansas (Walking Across America),"Howdy Y’all,

Currently writing to you from the wonderful town of Washington, KS. I was able to make it here in 3 days from Smith Center after I took a rest day to get over my little illness. Felt much better after taking a day to recover. 

The day I left off from Smith Center didn’t get off to a great start when I locked myself out of my hotel room in order to go stretch. The Innkeeper of the Buckshot Inn was up in Nebraska getting Chemo, so there wasn’t a way to get back in. She told me to try and pick the lock, which was much easier said than done with a Casey’s gift card. Eventually a guy she called came to come replace the lock. If you are ever in Smith Center please go visit the Buckshot Inn the people there are really nice and gave me 2 nights for $19, and I’m sure that they would appreciate the business. 

After the delay, I headed to Mankato. Along the way I got to pass the geographic center of the US which was pretty neat. Kansas is really at the center of the country (at least the lower 48). Eventually I made it to Mankato and I’m sure some of you are familiar with Mankato because the YouTube channel “Yes Theory” threw a Party in “the most boring town in America” there. It was kind of funny because I didn’t know what “Yes Theory” was until I got to Mankato. Nice town though.

On Thursday the goal was to get to Belleville. Easier said than done with a headwind. After I passed Scandia, the clouds started to look ominous so I was looking for a way to get off 36 when the storm rolled in. As soon as I got off it started raining and I quickly made my way to a barn. There I took shelter with Farmer John and his dog Mav. I had a nice time talking with Farmer John about the harvest and how much all of his farm equipment cost. After the rain I set out and Mav really wanted to come walking across Kansas with me. Farmer John had to come get him a couple of times. He had also warned me about the mud, which I thought I could push through. I couldn’t. So I had to trudge my way back to 36. Once I got back on there I made my way to Belleville.

Then finally yesterday the goal was to get to Washington. Which was a place that I was really looking forward to because the goal of my walk is to get from Washington state to Washington DC, so it was fun to stop at a Washington in the middle. Because of a hefty tail wind I was able to do about 33 miles in about 5 hours. The ancient midwestern proverb of “it wouldn’t be so cold/bad without the wind” was in full effect today. I even heard some people say it in Belleville. As such instead of pitching my tent at the campground, I decided to pitch my tent in the warm and spacious shower room at the campground. Not as bad as it sounds. Unfortunately I forgot to lock the door last night, so at around 11:30 last night, a guy comes in to take a shower and it scared the bejezzes out of me. His water heater had broke and he was a nice guy so not terrible, but definitely locked the door after that. 

Plan for today is to get to Marysville. Its looking like I’ll probably be able to finish Kansas on October 18th. Sorry to people on here who wanted me to come to Manhattan, Lawrence and Topeka but I gotta make it to St Joe to see my grandparents and cant delay with the weather getting colder. Because some people on here said I could walk across 36 into St Joseph, I reached out to their police department and they said I could and that they would even help me cross. So that’ll save me some time.

Other than that im still enjoying my time in Kansas and meeting lots of great people. As always the best place to follow my journey is on IG at walk2washington or at my website of the same name.

Additional thoughts:

1. A lot more trees: I have definitely noticed a decent amount more trees as I’ve gotten farther East. It is appreciated and im enjoying seeing the tinges of yellow. 

2. Towns that play music: IDk if this is a Kansas thing but this didn’t happen in any of the other states that I’ve walked through, but a lot of the towns play music out loud in their downtowns. It is  not bad, but it is kinda eerie when downtown is empty.

3. Windmills: I didn’t see any wind farms until I got to Belleville. For such a windy state I really expected there to be more. Especially since the land can still be used for farming and ranching. 

4. No breakfast spots: I often go to Mexican restaurants when I go to town for lunch or dinner because there is usually one in a town. But since I start most days in a town, I would love to get a hot breakfast;however, so many towns that I pass through don’t really have a spot or the spot is really inconvenient. 

5. Shrinking towns: Whenever I pass through a town I always check the Wikipedia page for info. Something I’ve noticed in most of the towns and counties that I’ve passed through though is that populations seem to be shrinking. I’ve also seen that school closures have been an issue in this area too. Im sure there are parts of Kansas that are growing, but are these trends common in other parts of the state?",2023-10-14 13:59:11+00:00
232,Kansas,IDENTIFIER-WEATHER-ATTITUDE,"weather, misty, enjoy",Day 3 Walking across Kansas (Walking Across America),"Not sure how frequently I will do these, but it seemed like in my last post people were interested in seeing what was happening along my journey. Yesterday seemed like a great day to highlight.

Started off the day from St Francis after a rest day and there was plenty of thunder to the West, but when I checked the radar I thought it would miss me (classic mistake).

I pretty much ran the whole way to Bird City with no rain up until that point. As soon as I got there a nice stranger named Alex saw me and came to hand me some water bottles. She was having to pretty much run after me because my walking speed was so fast lol. Very thankful for her.

The clouds were getting a little more ominous as I left Bird City, but the weather wasn’t saying any rain. So I kept walking until I felt some raindrops. Then the thunder started and there wasn’t really anywhere to take shelter. So I ended up sprinting to a dairy farm where i was able to shelter from the rain, lightning and hail in their office.

Once that cleared up, I set off again and thought the rain would be over for the day (wrong). I took some farm roads that had no traffic. I was heading to McDonald, KS when I checked the weather and it said I had 30 mins before the thunderstorm started up again. So we hauled ass through the corn fields to get to McDonald where I took shelter in a grocery store.

After that the rain was all done and I decided to pitch my tent at a rest stop off 36. It was here that maybe the most wild thing of the day happened. I called my grandparents in St Joseph to talk about a completely random matter and I mention to my pop pop that I was in McDonald. He then just casually mentions that my grandmother’s family had actually helped start the town back in the late 1800’s. Don’t think any of the family is still here, but this town that I had never heard of until yesterday was actually help started by my family and it was a complete coincidence that I called my grandparents on that exact day to learn that. Just wild to me.

Hope you all enjoyed reading this. I will probably make it to Atwood today so if anyone knows anyone there who could help me out give me a holler. Otherwise the best place to follow my journey through your great state is on IG at walk2washington.",2023-10-04 13:01:54+00:00
233,Kansas,IDENTIFIER-WEATHER-ATTITUDE,"weather, misty, enjoy",Day 7-10 Walking Across Kansas (Walking Across America)," 

Howdy y’all,

Last post I was leaving from Prairie Dog State Park just outside of Norton, KS and I am now in Smith Center, KS near the geographic center of the United States. I have been feeling a bit under the weather recently, not sure what, but I have been taking some nyquil and dayquil and been feeling a bit better. I decided to take a rest day today in Smith Center and got a motel last tonight and tonight. I usually don’t use hotels unless it makes sense and I got 2 nights for $19 (total) which definitely makes sense. Still meeting lots of friendly folks in Kansas and thought I’d share some takeaways from the past couple of days in no particular order of significance.

**I’ve really enjoyed the libraries in Kansas:** Earlier in the walk I was using libraries a lot more frequently to charge up my battery pack and use a computer. However, a lot of the libraries in small towns out West are not the most reliable or have the best hours. As I am typing this from the library in Smith Center, I am very thankful for the libraries I have gotten to use in Kansas. Plenty of very friendly and helpful librarians too. I can’t stress how awesome and important libraries are not just for me but so many others, don’t forget to use and support your local branch.

**Barn Quilts:** Thank you to all of those who reached out and helped explain barn quilts to me. I had been seeing a number of them, but was unsure of what they were. I have been really enjoying seeing them livening up towns and spaces everywhere I go. Funny enough I don’t think I have seen one on a barn yet.

**All of the towns along 36 are pretty similar:** I don’t mean that in a deriding way as every town has its own charm and character. It is just I feel as though I can guess what will be in a town before getting to the town, as the makeup of the towns are pretty similar. If the town is a county seat then along the part of 36 that runs through town there will probably be a Caseys, a subway, a pizza hut, a dollar general, a couple of gas stations, some mechanics and maybe a Tractor Supply company ( or something similar). Then the main street will run north/south a little way from 36 with some being a little more lively than others. Plenty of churches, a local grocer, county museum, a Mexican restaurant, the county courthouse, the library, city park and all of the other typical town components. My only frustration with the city design is that 36 turns from a two lane highway with a shoulder into a 4 lane road without a shoulder and no sidewalk once you enter a town. I’m usually able to get onto a connecting side street, but only after dealing with some hefty traffic.

**Pickup trucks are more dangerous to me than 18 wheelers (also please put your phone down while driving):** A lot of people have been warning me that because of the harvest that I need to watch out for the 18 wheelers. But I have been seeing the 18 wheelers since getting into Kansas and I try to remind these people that the pickup trucks are much scarier. If a pickup truck or an 18 wheeler happens to hit me (something I think about constantly), I am going to be flattened. The difference is that you will never see an 18 wheeler on their phone. In fact 18 wheelers often get over to the entire other lane for me or slow down when that is not possible and then give me a wave. Whereas, I can tell when someone is on their phone based on the way they are driving much sooner than I can see them or their phone. Just yesterday there were multiple close calls with people on their phones. I understand that there are nice and responsible drivers who operate pickup trucks, but the overwhelming majority of my close calls involve oversized pickup trucks. 

People need to understand that when you are driving 65+ miles an hour in a huge hunk of metal that you are operating a potential weapon. The sad reality is that me or anyone else's finger wagging is not going to stop people from using their phones while driving. So long as cell phones play a huge role in people’s lives there will always be crashes stemming from distracted driving. If auto manufacturers wanted to engineer a way that would make it impossible to operate your car unless you relinquished use of your phone for the duration of your drive, they most certainly could. For most of the lifespan of cars, cell phones were not an issue and people still got where they needed to and still listened to music. But where is the profit in making that a reality? And if it don’t make dollars then it don’t make sense. 

This is something I am incredibly passionate about as my life is on the line everyday. And my life isn’t just on the line on US-36, it is also on the line in cities where around 83% of Americans live. It is also not only me as about a quarter of Americans can’t drive whether they are too young, too old, disabled, or for whatever other reasons. Additionally, it’s also not just people outside of cars as distracted drivers injure and kill other drivers too. Issues like distracted driving require us to think systemically. No amount of finger waving, public service announcements, or blaming individuals is going to fix the issue. But finding innovative solutions such as new safety features in cars and redesigning a transportation system with human error in mind will help us overcome the problem. 

Like I always say, “the advocacy is built into the activity.” I understand that walking across America is dangerous, but that doesn't mean I can’t advocate for things I believe would make the journey safer. That is why I have been raising money for AmericaWalks. They are the only national pedestrian advocacy organization and they do great work in trying to reduce pedestrian injuries and fatalities, as well as traffic injuries and fatalities in general. I always appreciate when people hope that I stay safe, but if you want to help with that mission, please consider either donating to AmericaWalks or by getting involved in your local communities to make them safer for all road users.

&#x200B;

Those are plenty of words for now, maybe I just need to keep walking or else all of the thoughts from my lonely miles will appear lol. But once again I am really enjoying Kansas and all the lovely people I am meeting. I am over halfway to St. Joseph and should be halfway through Kansas tomorrow. As always the best place to follow my journey through your great state is on IG at walk2washington.

https://preview.redd.it/qvqwalbqmftb1.jpg?width=698&format=pjpg&auto=webp&s=ff28e96b3876ce3b1ed84202d094f0bf95985436

https://preview.redd.it/jyg5bobqmftb1.jpg?width=698&format=pjpg&auto=webp&s=85be2e6d359c40a6d372272b6b4f7fa6a46cc40a

https://preview.redd.it/ffp4lqbqmftb1.jpg?width=698&format=pjpg&auto=webp&s=741baac521b68a4bf988443daf407137c9ebce2c

https://preview.redd.it/aa7jgsbqmftb1.jpg?width=698&format=pjpg&auto=webp&s=79c9b9b3df740e9190f8493b53b77ddab421c825

https://preview.redd.it/8qfqaobqmftb1.jpg?width=165&format=pjpg&auto=webp&s=5bb703d155158202c87e09c9b4932d1fc525e427

&#x200B;",2023-10-10 20:10:53+00:00
234,Kansas,IDENTIFIER-WEATHER-ATTITUDE,"weather, misty, enjoy","June 17 - 23, 2024 Kaw Valley Almanac: summer solstice, wheat harvest, beebalm and more",,2024-06-16 22:48:43+00:00
235,Kansas,IDENTIFIER-WEATHER-ATTITUDE,"weather, misty, enjoy","February 26 - March 3, 2024 Kaw Valley Almanac: zodiacal light, crawdads and American woodcock calls",,2024-02-26 04:23:56+00:00
236,Kansas,IDENTIFIER-WEATHER-ATTITUDE,"weather, misty, enjoy","September 4 - 10, 2023 Kaw Valley Almanac: on sunflowers, bird migration and sun in your eyes",,2023-09-04 03:59:09+00:00
237,Kansas,IDENTIFIER-WEATHER-ATTITUDE,"weather, misty, happy","June 17 - 23, 2024 Kaw Valley Almanac: summer solstice, wheat harvest, beebalm and more",,2024-06-16 22:48:43+00:00
238,Kansas,IDENTIFIER-WEATHER-ATTITUDE,"weather, misty, happy","April 17 - 23, 2023 Kaw Valley Almanac: luna moths, morels and other spring wild edibles: Happy Earth Day!",,2023-04-17 02:38:52+00:00
239,Kansas,IDENTIFIER-WEATHER-ATTITUDE,"weather, drizzle, love",Day 11-13 of Walking Across Kansas (Walking Across America),"Howdy Y’all,

Currently writing to you from the wonderful town of Washington, KS. I was able to make it here in 3 days from Smith Center after I took a rest day to get over my little illness. Felt much better after taking a day to recover. 

The day I left off from Smith Center didn’t get off to a great start when I locked myself out of my hotel room in order to go stretch. The Innkeeper of the Buckshot Inn was up in Nebraska getting Chemo, so there wasn’t a way to get back in. She told me to try and pick the lock, which was much easier said than done with a Casey’s gift card. Eventually a guy she called came to come replace the lock. If you are ever in Smith Center please go visit the Buckshot Inn the people there are really nice and gave me 2 nights for $19, and I’m sure that they would appreciate the business. 

After the delay, I headed to Mankato. Along the way I got to pass the geographic center of the US which was pretty neat. Kansas is really at the center of the country (at least the lower 48). Eventually I made it to Mankato and I’m sure some of you are familiar with Mankato because the YouTube channel “Yes Theory” threw a Party in “the most boring town in America” there. It was kind of funny because I didn’t know what “Yes Theory” was until I got to Mankato. Nice town though.

On Thursday the goal was to get to Belleville. Easier said than done with a headwind. After I passed Scandia, the clouds started to look ominous so I was looking for a way to get off 36 when the storm rolled in. As soon as I got off it started raining and I quickly made my way to a barn. There I took shelter with Farmer John and his dog Mav. I had a nice time talking with Farmer John about the harvest and how much all of his farm equipment cost. After the rain I set out and Mav really wanted to come walking across Kansas with me. Farmer John had to come get him a couple of times. He had also warned me about the mud, which I thought I could push through. I couldn’t. So I had to trudge my way back to 36. Once I got back on there I made my way to Belleville.

Then finally yesterday the goal was to get to Washington. Which was a place that I was really looking forward to because the goal of my walk is to get from Washington state to Washington DC, so it was fun to stop at a Washington in the middle. Because of a hefty tail wind I was able to do about 33 miles in about 5 hours. The ancient midwestern proverb of “it wouldn’t be so cold/bad without the wind” was in full effect today. I even heard some people say it in Belleville. As such instead of pitching my tent at the campground, I decided to pitch my tent in the warm and spacious shower room at the campground. Not as bad as it sounds. Unfortunately I forgot to lock the door last night, so at around 11:30 last night, a guy comes in to take a shower and it scared the bejezzes out of me. His water heater had broke and he was a nice guy so not terrible, but definitely locked the door after that. 

Plan for today is to get to Marysville. Its looking like I’ll probably be able to finish Kansas on October 18th. Sorry to people on here who wanted me to come to Manhattan, Lawrence and Topeka but I gotta make it to St Joe to see my grandparents and cant delay with the weather getting colder. Because some people on here said I could walk across 36 into St Joseph, I reached out to their police department and they said I could and that they would even help me cross. So that’ll save me some time.

Other than that im still enjoying my time in Kansas and meeting lots of great people. As always the best place to follow my journey is on IG at walk2washington or at my website of the same name.

Additional thoughts:

1. A lot more trees: I have definitely noticed a decent amount more trees as I’ve gotten farther East. It is appreciated and im enjoying seeing the tinges of yellow. 

2. Towns that play music: IDk if this is a Kansas thing but this didn’t happen in any of the other states that I’ve walked through, but a lot of the towns play music out loud in their downtowns. It is  not bad, but it is kinda eerie when downtown is empty.

3. Windmills: I didn’t see any wind farms until I got to Belleville. For such a windy state I really expected there to be more. Especially since the land can still be used for farming and ranching. 

4. No breakfast spots: I often go to Mexican restaurants when I go to town for lunch or dinner because there is usually one in a town. But since I start most days in a town, I would love to get a hot breakfast;however, so many towns that I pass through don’t really have a spot or the spot is really inconvenient. 

5. Shrinking towns: Whenever I pass through a town I always check the Wikipedia page for info. Something I’ve noticed in most of the towns and counties that I’ve passed through though is that populations seem to be shrinking. I’ve also seen that school closures have been an issue in this area too. Im sure there are parts of Kansas that are growing, but are these trends common in other parts of the state?",2023-10-14 13:59:11+00:00
