ID,STATE,KEYWORD TYPE,KEYWORD,TITLE,TEXT,DATE
100,Kansas,IDENTIFIER-WEATHER-ATTITUDE,"weather, storm, love",current kansan former kansan,curious many folk subreddit current kansa resident versus former kansa resident grew western kansa 1980s lived joco 90 live massachusetts recent visit kansa confirmed heart firmly planted somewhere high plain dont currently live kansa please share following subreddit let u hear story,2023-04-19
102,Kansas,IDENTIFIER-WEATHER-ATTITUDE,"weather, thunderstorm, love",beauty flint hill cant beat favorite place earth recent sunset cruise flint hill wildlife drive near cassoday,x200b near vestring ranch cassoday,2023-05-23
104,Kansas,IDENTIFIER-WEATHER-ATTITUDE,"weather, rain, love",artist chalk drawing upset landlord win big tiktok,hutchinson substitute teacher started drawing whimsical character public sidewalk front apartment week thought people would smile mostly kara vaughn hutchinson teach art hutchinson middle school love draw chalk substance washed water rain vaughns surprise landlord upset drawing allegedly told disrespectful needed clean drawing immediately vaughn posted drawing tiktok varakaughn gotten positive remark people across country didnt want clean called city hutchinson told ordinance drawing appropriate picture chalk public sidewalk news confirmed city ordinance exists child keep drawing hopscotch board tictactoe game vaughn relaxing said love dog drawing even though rain artwork disappears scraped posted went everywhere tiktok said ive pretty like go flow person much support engagement love tiktok community gave lot confidence go ahead stick since vaughn started posting disneylike pokmonlike chalk drawing tiktok controversy landlord profile increased garnered 8 million view across country vaughn scared kicked apartment havent said going try evict said feel like want im afraid something going happen dont know really dont good confrontation still vaughn determined beautify city hoping others join fun said would like special chalk day hutchinson trying get day started also hoping landlord grow understand beauty drawing,2023-06-05
114,Kansas,IDENTIFIER-WEATHER-ATTITUDE,"weather, rainy, love",please send someone pick weather,angry drunk arent prepared tornado hail measured unit fruit sport ball please send someone take home love colorado,2023-06-23
122,Kansas,IDENTIFIER-WEATHER-ATTITUDE,"weather, storm, love",riding school bus vinland kansa 60,moved baldwin kansa sometime 1965 rural area mile outside vinland culture shock right away wed always lived small town olathe gardner twice baldwin wasnt big fan school like living baldwin everything needed theater college kid going baker actual college dorm scattered around town summer played little league cardinal actually try day make team world took hit moved small 12 acre cut hillside still see red dirt taste rusty well water came school vinland junior high 6th grade junior high 6 7 8 school ancient added modern building grade 15 part still life believe old building gone dont believe school anymore turned life even better kid 13 kid class everyone friendly downside riding bus 2 hour day hour morning hour night mainly first morning last night ever ridden bus country road like riding rollercoaster rolling hill eastern kansa complete enough rut bump drop shake brain loose spent time trying read science fiction book dealing motion sickness end need read got past sick stomach two hour day life wound way treecovered narrow gravel country road often clipped overhanging branch make room passing car tractor combine way field somewhere wasnt slow trip bus driver often college student drove like wind bullseye got tossed bounce constantly entire trip since seat belt could careful end aisle backside often driver face large mirror looking back u grin face sometimes gravel dust would come alwaysopen window try choke u death vehicle passed break go bus stopped drop pick someone catch breath quickly nightly trip different everyone relaxed talkative girl often sang song hour henry 8th favorite u boy would groan started yet another round henry well nevermind get drift sister 18 month younger friend cheryl often led singing would try ignore except look catch peek best friend sitting someone crush 3 year never ever let felt still hurt bit sometimes weather often made trip even treacherous mud snow seldom missed day school usually took ice storm keep u home school boy fun usually towards end run bus emptied wed sit furthest back seat slide aisle wed stand surf bus wilding changing angle hill bump sometimes wed catch driver watching u usually didnt say anything friend tim chanay talked joining air force becoming fighter pilot one day dad flew crop duster vinland aerodrome could get exciting moving overhanging tree limb breakneck speed time part never really danger except one day one cold icy day broken limb tree apparently broke due ice three sitting top branch waited u pas buy pickup truck forced driver crash limb came front windshield penetrated bus least 10 foot back seating area came within foot little girl sitting ahead u luckily one seriously hurt bus half empty time thing remember happening senior high school one ever rode bus thought funny pull cord jacket apparently looped around neck tight immediately started choking vision went black next thing remember driver dragging kid bus arm escorted left standing quickly came another immediate stop driver lept bus went running back towards kid fully matched driver height started yelling kid thrown rock bus started leave college kid wasted time dealing besides two incident endless hill bump roller coaster drop wed run rattlesnake crossing road rabbit dog dodging bus passed endless farmland nestled surrounding timber forest went 3 year started going baldwin ninth grade year high school long started riding friend car pickup school one named allan 46 ford pickup proud truck without working starter hed always park could push get started popping clutch get engine going moved away sophomore year day miss school vinland new high school baldwin opened freshman year first school ever experienced air conditioning since never home school x200b mike young living paola k thanks reading x200b,2023-07-02
146,Kansas,IDENTIFIER-WEATHER-ATTITUDE,"weather, rainy, enjoy",everything cheap wichita,im wichita business feel like went back time late 90 everything cheap compared california even restaurant cheap cant even get mediocre sandwich live less 15 see lot town great im confused massive difference cost v california lot house price nice car honestly feel like im time warp different country weather horrific right though would rather pay crazy amount house able enjoy outdoors every day im guessing thats big part,2023-08-25
170,Kansas,IDENTIFIER-WEATHER-ATTITUDE,"weather, rainy, enjoy",day 3 walking across kansa walking across america,sure frequently seemed like last post people interested seeing happening along journey yesterday seemed like great day highlight started day st francis rest day plenty thunder west checked radar thought would miss classic mistake pretty much ran whole way bird city rain point soon got nice stranger named alex saw came hand water bottle pretty much run walking speed fast lol thankful cloud getting little ominous left bird city weather wasnt saying rain kept walking felt raindrop thunder started wasnt really anywhere take shelter ended sprinting dairy farm able shelter rain lightning hail office cleared set thought rain would day wrong took farm road traffic heading mcdonald k checked weather said 30 min thunderstorm started hauled as corn field get mcdonald took shelter grocery store rain done decided pitch tent rest stop 36 maybe wild thing day happened called grandparent st joseph talk completely random matter mention pop pop mcdonald casually mention grandmother family actually helped start town back late 1800s dont think family still town never heard yesterday actually help started family complete coincidence called grandparent exact day learn wild hope enjoyed reading probably make atwood today anyone know anyone could help give holler otherwise best place follow journey great state ig walk2washington,2023-10-04
194,Kansas,IDENTIFIER-WEATHER-ATTITUDE,"weather, rainy, enjoy",day 46 walking across kansa walking across america,howdy yall ive made mcdonald k prairie dog state park outside norton k definitely covering good distance probably best since weather beginning change morning first around freezing since march boy moving shaking head east south thought id share highlight thought last couple day specific order campground one biggest surprise abundance free public campground along 36 long make town reliable spot sleep case every night far public land much readily available western state traversed tad worried kansa campground blessing im currently prairie dog state park fun fact park prairie dog didnt actually live 1980s even though park started 1967 truck getting walk lot big truck 18 wheeler along journey maybe surprisingly 18 wheeler driver probably courteous kansa especially either slow get complete lane really appreciated think ive probably seen driver multiple time reading thank much corn think lot driver hauling corn seeing everywhere expected see plenty midwest still much one big thing interested learning west water western k imagine lot corn fed ogallala aquifer id also imagine finite water supply isare good journalism resource learn aquifer issue surrounding oberlin really enjoyed aesthetic oberlin brick road covered walkway historic building didnt spend much time cool place check walk around sure county museum atwood able go rawlins county museum every time go town museum always find something interesting example rawlins county home guy popularized smokey bear apparently smokey bear longest running psa american history additionally real life smokey bear rescued fire new mexico brought national zoo dc great time talking lynette oversaw museum dont sleep little inconspicuous museum always learn something burr sticker thorn wish known coming k done number tire able get slime oberlin looking forward day arent problem anyone know stop issue east tanner dad lastly 30 mile day oberlin man pull car little bit front go trunk get something approach car man carrying two water bottle offer get chatting tell tanner dad sweet guy first day k believe lacys absolutely sweetest family around need drywall work done nw k one id recommend highly probably run long hope yall enjoyed definitely better anything say place ive really enjoyed time k far met many friendly people already looking forward much always best place follow journey great state ig walk2washington,2023-10-07
202,Kansas,IDENTIFIER-WEATHER-ATTITUDE,"weather, rainy, love",day 710 walking across kansa walking across america,howdy yall last post leaving prairie dog state park outside norton k smith center k near geographic center united state feeling bit weather recently sure taking nyquil dayquil feeling bit better decided take rest day today smith center got motel last tonight tonight usually dont use hotel unless make sense got 2 night 19 total definitely make sense still meeting lot friendly folk kansa thought id share takeaway past couple day particular order significance ive really enjoyed library kansa earlier walk using library lot frequently charge battery pack use computer however lot library small town west reliable best hour typing library smith center thankful library gotten use kansa plenty friendly helpful librarian cant stress awesome important library many others dont forget use support local branch barn quilt thank reached helped explain barn quilt seeing number unsure really enjoying seeing livening town space everywhere go funny enough dont think seen one barn yet town along 36 pretty similar dont mean deriding way every town charm character feel though guess town getting town makeup town pretty similar town county seat along part 36 run town probably caseys subway pizza hut dollar general couple gas station mechanic maybe tractor supply company something similar main street run northsouth little way 36 little lively others plenty church local grocer county museum mexican restaurant county courthouse library city park typical town component frustration city design 36 turn two lane highway shoulder 4 lane road without shoulder sidewalk enter town im usually able get onto connecting side street dealing hefty traffic pickup truck dangerous 18 wheeler also please put phone driving lot people warning harvest need watch 18 wheeler seeing 18 wheeler since getting kansa try remind people pickup truck much scarier pickup truck 18 wheeler happens hit something think constantly going flattened difference never see 18 wheeler phone fact 18 wheeler often get entire lane slow possible give wave whereas tell someone phone based way driving much sooner see phone yesterday multiple close call people phone understand nice responsible driver operate pickup truck overwhelming majority close call involve oversized pickup truck people need understand driving 65 mile hour huge hunk metal operating potential weapon sad reality anyone elses finger wagging going stop people using phone driving long cell phone play huge role people life always crash stemming distracted driving auto manufacturer wanted engineer way would make impossible operate car unless relinquished use phone duration drive certainly could lifespan car cell phone issue people still got needed still listened music profit making reality dont make dollar dont make sense something incredibly passionate life line everyday life isnt line us36 also line city around 83 american live also quarter american cant drive whether young old disabled whatever reason additionally also people outside car distracted driver injure kill driver issue like distracted driving require u think systemically amount finger waving public service announcement blaming individual going fix issue finding innovative solution new safety feature car redesigning transportation system human error mind help u overcome problem like always say advocacy built activity understand walking across america dangerous doesnt mean cant advocate thing believe would make journey safer raising money americawalks national pedestrian advocacy organization great work trying reduce pedestrian injury fatality well traffic injury fatality general always appreciate people hope stay safe want help mission please consider either donating americawalks getting involved local community make safer road user x200b plenty word maybe need keep walking else thought lonely mile appear lol really enjoying kansa lovely people meeting halfway st joseph halfway kansa tomorrow always best place follow journey great state ig walk2washington x200b,2023-10-10
218,Kansas,IDENTIFIER-WEATHER-ATTITUDE,"weather, rainy, love",day 1113 walking across kansa walking across america,howdy yall currently writing wonderful town washington k able make 3 day smith center took rest day get little illness felt much better taking day recover day left smith center didnt get great start locked hotel room order go stretch innkeeper buckshot inn nebraska getting chemo wasnt way get back told try pick lock much easier said done caseys gift card eventually guy called came come replace lock ever smith center please go visit buckshot inn people really nice gave 2 night 19 im sure would appreciate business delay headed mankato along way got pas geographic center u pretty neat kansa really center country least lower 48 eventually made mankato im sure familiar mankato youtube channel yes theory threw party boring town america kind funny didnt know yes theory got mankato nice town though thursday goal get belleville easier said done headwind passed scandia cloud started look ominous looking way get 36 storm rolled soon got started raining quickly made way barn took shelter farmer john dog mav nice time talking farmer john harvest much farm equipment cost rain set mav really wanted come walking across kansa farmer john come get couple time also warned mud thought could push couldnt trudge way back 36 got back made way belleville finally yesterday goal get washington place really looking forward goal walk get washington state washington dc fun stop washington middle hefty tail wind able 33 mile 5 hour ancient midwestern proverb wouldnt coldbad without wind full effect today even heard people say belleville instead pitching tent campground decided pitch tent warm spacious shower room campground bad sound unfortunately forgot lock door last night around 1130 last night guy come take shower scared bejezzes water heater broke nice guy terrible definitely locked door plan today get marysville looking like ill probably able finish kansa october 18th sorry people wanted come manhattan lawrence topeka got ta make st joe see grandparent cant delay weather getting colder people said could walk across 36 st joseph reached police department said could would even help cross thatll save time im still enjoying time kansa meeting lot great people always best place follow journey ig walk2washington website name additional thought 1 lot tree definitely noticed decent amount tree ive gotten farther east appreciated im enjoying seeing tinge yellow 2 town play music idk kansa thing didnt happen state ive walked lot town play music loud downtown bad kinda eerie downtown empty 3 windmill didnt see wind farm got belleville windy state really expected especially since land still used farming ranching 4 breakfast spot often go mexican restaurant go town lunch dinner usually one town since start day town would love get hot breakfasthowever many town pas dont really spot spot really inconvenient 5 shrinking town whenever pas town always check wikipedia page info something ive noticed town county ive passed though population seem shrinking ive also seen school closure issue area im sure part kansa growing trend common part state,2023-10-14
288,Kansas,IDENTIFIER-WEATHER-ATTITUDE,"weather, rainy, love",looking evergy user lost power july january,hello everyone hope allowed im journalist kansa news service kcur public radio im looking people interview story losing power severe weather july january know lost power day july massive wind storm knocked tree anyone lost power also lose power january anyone willing share experience radio news story would love hear message send email dlysenkcurorgmailtodlysenkcurorg thanks x200b,2024-01-22
312,Kansas,IDENTIFIER-WEATHER-ATTITUDE,"weather, storm, love",miss kansa post chart,week ago made post asking people missed kansa got hundred reply thanks tallied roughly everything mentioned comment made completely unscientific chart thought number one spot would taken storm bbq turned people kind nice,2024-03-10
354,Kansas,IDENTIFIER-WEATHER-ATTITUDE,"weather, storm, love",thanks reply visiting today,hi posted week ago opinion kck v kc really leaning kck area relocate four kiddos age 7 10 14 15 florida got plethora incredibly thoughtful reply thank much would leaving aging parent behind fl feel rather guiltridden sad healthy 70 unrelated post feel like abandonment dad isnt taking well leaving friend great opportunity could change life wonderful way flying literally two hour last minute storm brewing gulf eldest son wanted bring first solo time bc rooted entering 9th10th grade husband two youngest join u day said see definitely plan drive around neighborhood many suggested get feel go park eat bbq steak open going kc soccer video game music usual stuff would love give bit slice life excited little scared also want suggest dm name therapist might help guilt feeling transition process id really appreciate thanks really looking forward getting know community,2024-08-04
358,Kansas,IDENTIFIER-WEATHER-ATTITUDE,"weather, storm, love",k rental lease issue concerning possible unsafe house,renting house private homeowner property management company discovered basement wall collapsing discovered water leak found storm contractor came look said appears tried patch leak several time foundation house shifted badly water get storm thats bad enough wall backyard fix wall would need excavate backyard replace limestone currently appropriate material 6month walkthrough prop management employee said discussing homeowner terminating lease since wanting pay 30000 fix wall said began looking another place rent told going move last week went finalize plan informed homeowner want break lease would rather explore option installing pump get water basement first several issue actual water basement outside inclement weather even 3 fairly small leak basement one around water heater one corner collapsing wall one wall drywall pump would fix wall shifting foundation caused myriad issue including warped floor back door stay shut unless force deadbolt secure brought employee looking kansa city housing since house viable option able find housing closer live informed lease includes clause state order move lease end would need pay 500 early vacate fee responsible rent utility someone else rent home lease end march 2025 question issue qualify house unsafe basement window shut wall pushed yard door open slightest breeze deadbolt secured submitted maintenance work door three month ago fix issue make house unsafe would open door able get lease without responsible two separate rent find house city pet friendly kc along job career please let know left relevant information encountered issue like want know legal option meet property management company 1016,2024-10-10
366,Kansas,IDENTIFIER-WEATHER-ATTITUDE,"weather, storm, love",storm watch wednesday,please weather aware tomorrow,2024-10-30
377,Kentucky,IDENTIFIER-WEATHER-ATTITUDE,"weather, rain, love",warm weather january midmonth,warmer normal weather look continue middle month snow chance may possible time however thursday night early friday may yield rain snow shower part eastern northeastern kentucky another system push weekend mostly rain expected wintry mix snow cant completely ruled especially true northern northeastern kentucky,2023-01-04
400,Kentucky,IDENTIFIER-WEATHER-ATTITUDE,"temperature, storm, love",severe storm possible tomorrow,isolated severe storm remain possible entire area tomorrow afternoon damaging wind isolated tornado look greatest threat time cooler temperature crash late tomorrow snow shower squall light snow remain possible later thursday friday,2023-01-11
408,Kentucky,IDENTIFIER-WEATHER-ATTITUDE,"weather, storm, love",opinion defining characteristic lexington culture,friend mine writing recording album song kentucky ala sufjan stevens naturally wanted write song lexington main focus lyric ive lexington plenty time life ive never lived never really explored nook cranny thing make city especially unique im crowd sourcing intel opinion aspect lexington culture stand,2023-02-07
410,Kentucky,IDENTIFIER-WEATHER-ATTITUDE,"weather, storm, love",severe threat increasing state,severe threat upgraded spc enhanced risk 35 much state tomorrow damaging wind hail tornado remain possible one round look possible overnight tonight another tomorrow morning afternoon remain alert,2023-02-15
426,Kentucky,IDENTIFIER-WEATHER-ATTITUDE,"weather, rain, love",severe risk continues today,severe threat continues today scaled back slightly latest update spc damaging wind hail tornado still look possible flood watch also much state heavy rain continue storm push remain alert,2023-02-16
450,Kentucky,IDENTIFIER-WEATHER-ATTITUDE,"weather, storm, love",severe storm possible tomorrow,severe storm possible entire state tomorrow isolated tornado damaging wind look probable greatest threat come afternoon remain alert,2023-03-02
458,Kentucky,IDENTIFIER-WEATHER-ATTITUDE,"weather, rain, love",typical weather 20222023,hey family moved shelby county late 2021 lived country weather kentucky extreme ever seen constant tornado watch high wind event flooding rain crazy winter cold snap ive shelled money weatherrelated damage year past decade combined expect past year weather norm thanks,2023-04-01
482,Kentucky,IDENTIFIER-WEATHER-ATTITUDE,"weather, storm, love",severe storm possible sunday,severe storm possible sunday cold front approach area sunday strong severe storm look spawn move area look form earlier day across western part region move overnight damaging wind hail tornado look possible make sure monitor forecast share,2023-06-23
498,Kentucky,IDENTIFIER-WEATHER-ATTITUDE,"weather, storm, love",severe weather updatesunday,part state upgraded enhanced risk 35 tomorrow afternoon update storm prediction center damaging wind appear main threat tornado hail also possible greatest tornado threat appears across central northern western kentucky look one round early day severe storm look come night make sure remain alert,2023-06-25
514,Kentucky,IDENTIFIER-WEATHER-ATTITUDE,"temperature, storm, love",weather updatejune 26th,strong severe storm pushed area last night expected numerous survey ongoing across state looking damage received overall dont think storm flourished well could cap helped dampen storm development early storm got going wild looking ahead shower storm possible today across northern eastern kentucky courtesy northwesterly flow severe storm expected shower storm look possible tomorrow eastern kentucky ridge look shift eastward end week cause increase temperature shortwaves look ride ridge impact area increase threat strong severe storm time ridge look break late week,2023-06-26
