ID,STATE,KEYWORD TYPE,KEYWORD,TITLE,TEXT,DATE
522,Kentucky,IDENTIFIER-WEATHER-ATTITUDE,"weather, rain, love",strong severe storm dangerous heat,strong severe storm looking possible end workweek ahead ridge build southwest trough shift slightly northeast allow heat build area part western kentucky could hit 100 multiple day end week already excessive heat watch western ky ridge shortwaves look ride state northwest increase shower storm chance storm prediction center already highlighting part state lowend severe storm threat thursday think another threat friday maybe even saturday definitely something watch think type system damaging wind main threat heavy rain lightning also possible visit,2023-06-27
546,Kentucky,IDENTIFIER-WEATHER-ATTITUDE,"weather, rainy, happy",severe storm possible next three day,happy thursday everyone eye severe storm threat next three day round shower storm look ride along edge building ridge morning complex strong severe storm pushing across part western kentucky damaging wind main threat thus far later evening another round storm look roll across state location round still question latest hire model showing cluster place newest hrrr run show impacting central eastern kentucky weakening push state definitely something watch region round strong severe storm look possible friday saturday focus round shift northeast round far today mcss timing location severity still question uncertainty high difficulty forecasting mesoscale convective system mcss riding along edge ridge,2023-06-29
562,Kentucky,IDENTIFIER-WEATHER-ATTITUDE,"weather, rainy, happy",severe storm look likely today,happy sunday everyone strong severe storm possible today look get break tomorrow storm prediction center upgraded state enhanced risk 35 latest outlook shower storm moved across state early morning clearing taking place allow destabilization help storm form later afternoon evening damaging wind main threat make sure visit ekyrrgweathercom,2023-07-02
566,Kentucky,IDENTIFIER-WEATHER-ATTITUDE,"weather, storm, love",wild weather,crazy storm front moved benton siren going town tree whipping around like grass definitely tornado weather cant believe still power stay safe everyone,2023-07-02
567,Kentucky,IDENTIFIER-WEATHER-ATTITUDE,"weather, storm, love",central kentucky weather,storm coming west look merge close harrodsburg ky chance favorable strong storm vecinity looking eastward weather aware,2023-07-02
594,Kentucky,IDENTIFIER-WEATHER-ATTITUDE,"weather, rainy, love",lexington,hey everyone wife debating moving lexington area early 2024 work healthcare currently live maryland visited louisville time bourbon trail day time guy give pro con living lexington coming lex october see enjoy city advice would great,2023-07-04
602,Kentucky,IDENTIFIER-WEATHER-ATTITUDE,"weather, rainy, love",finished walking kentucky walking across america,howdy yall finished walking kentucky couple day back taking 4 day get caveinrock il clarksville tn shortest state walk dont feel though got learn much state place spent time however like rest country got explore place never meet plenty kind stranger along way getting across ohio river hopped onto sr91 surprise also literal trail tear route sr91 way hopkinsville cant say best place walk experience unlike u designated highway like us41 state highway dont provide shoulder usually least favorite place walk however since area amish country think driver little considerate sharing road tendency see horse buggy followed path marion fredonia gifted free food gas station clerk although plan get tall boi celebrate getting state gas station one fredonia didnt sell alcohol first time happened 250 day walk including walked utah kansa something shock found place sleep started next morning next day passed princeton lunch mexican restaurant typical cuisine met nice guy paid meal told talk town football team got busted drug assumed weed lol walked along rest day pitched tent church little covering protect rain night third day making way hopkinsville little rainy day nothing bad got hopkinsville immediately started seeing strange sight including street named dink embrys buttermilk memorial flag commemorating jefferson davis highway learned born far outside gun store large replica donatello michael bay adaptation teenage mutant ninja turtle fortunate pay visit trail tear commemorative park site could definitely use love care support eventually made lovely host night beth barry hopkinsville fed let laundry gave warm place sleep even invited son wedding make atlanta january 13th one thing done along walk trade item folk host either significance area barry beth got trade christmas decoration made one host near harrisburg il another christmas ornament hopkinsville community college well lucky horseshoe kentucky last day walking kentucky able take us41a although busy wide shoulder took highway way oak grove fort campbell army base 101st airborne division little photo op welcome tennessee sign crossed volunteer state much like state walk car dangerous difficult challenge faced corresponding lack infrastructure accommodate folk outside car reaffirmed conviction raise money awareness americawalks leading national walkability pedestrian advocacy organization would like create walkable community enable less car dependency build safer kentucky outside inside car please consider donating checking americawalks americawalksorg additionally work happens state local level encourage people get active involved locally also like state folk met kentucky kind generous people helped along journey regret didnt get opportunity meet appreciate kentucky hope back someday explore part state sincerely thanks hmr,2023-12-05
606,Kentucky,IDENTIFIER-WEATHER-ATTITUDE,"weather, wet, happy",kentucky native resident tourist whomever else might find interesting,compilation historical highlight ya know fact famous native kentuckian text copied online source allinclusive list 1792 kentucky first state western frontier join union 1816 first promoted mammoth cave 336 mile mapped passage world longest cave 379 foot deep contains least 5 level passage second niagara fall popular tourist attraction u became national park july 1 1941 1856 first enamel bathtub made louisville 1883 first electric light bulb shown louisville thomas alva edison introduced invention crowd southern exposition 1887 mother day first observed henderson teacher mary wilson became national holiday 1916 1893 happy birthday probably sung song world written two louisville sister mildred patricia hill late 19th century bibb lettuce first cultivated jack bibb frankfort kentucky 1896 first known set male quintuplet born paducah 1934 cheeseburger first tasted kaelins restaurant louisville 1937 first wigwam village motel unit shape teepee built frank redford cave city world largest baseball bat full one hundred twnty 120 foot tall weighing 68000 pound seen louisville slugger museum louisville jefferson co chevrolet corvette manufactured bowling green covington st mary cathedralbasilica assumption home world largest hand blown stained glass window existence measure astounding 24 foot 67 foot contains 117 different figure world largest crucifix standing sixty 60 foot tall bardstown nelson co fort knox hold 6 billion worth gold largest amount stored anywhere world jif plant lexington world largest peanut butter producing facility kentucky resort park state nation middlesboro united state city built inside meteor crater checked google earth appears 4 14 mile across 360 foot deep newport home world peace bell world largest freeswinging bell pike county world largest producer coal pikeville annually lead nation per caput consumption pepsicola postit note made exclusively cynthiana ky shaker village pleasant hill largest historic community kind united state christian county wet bourbon county dry wet sell liquor dry barren county fertile land state lake cumberland mile shoreline state florida kentucky best known beautiful blue grass let u forget basketball race horse sunny california longer beautiful people come blue moon kentucky many em start celebrity born andor raised ky george clooney sexiest man alive johnny depp sexiest man alive tom cruise sexiest man alive ashley judd one sexiest woman alive nick lachey kevin ricardson backstreet boy brian litrell backstreet boy lee major muhammad ali victor mature annie potts designing woman sean young dwight yoakam singeractor slingblade roswell panic room diane sawyer john carpenter director ned beatty back school deliverance life harry dean stanton molly ringwalds dad pretty pink florence henderson mr brady billy ray cyrus thus daughter hannah montanaonce removed chuck woolery james best sheriff duke hazard charles napier bureaucrat tryin save as rambo ii everly naomi judd winona judd bill monroe father bluegrass tom hall john michael montgomery loretta lynn first lady country music dwain messer patti loveless ricky skaggs keith whitley rosemary clooney jennifer lawrence name interesting thing statefor example rule rural kentucky rest article removed preserve content,2024-04-03
608,Kentucky,IDENTIFIER-WEATHER-ATTITUDE,"weather, storm, love",camping north lexington,hey everyone im planning heading tomorrow camp week three spring campground north lexington another couple coming sw michigan looking weather forecast debating waiting monday come downim typically shouldnt bad let go person long way home something happen everyones thought forecast area see lot flooding big storm help advice appreciated,2024-05-24
616,Kentucky,IDENTIFIER-WEATHER-ATTITUDE,"weather, rainy, love",looking move kentucky would love real life info place,make long story short try organized next couple year mother possibly brother looking selling house upstate ny god hate moving kentucky looked lot info pick state pretty set kentucky number reason said never moved state looked bit hard online sort reality truth b pomp try highlight keypoints looking would appreciate help narrowing good city look importantly good city avoid x200b looking suburb pretty important like space dont want full blown country nearest hospital store hour away would like avoid street house house top suburb 1020 minute city away would great would like businessesstoresdoctorsfast food placesjobs etc within realistic distance away weather would assume mostly state enjoy 4 season living currently near buffalo done snow storm give u literally foot lake effect snow flip side huge fan super hot humid know kentucky seems rather warm especially summer month expected dont want super humid top good neighborhoodcity vitally important kentucky seems great review state whole dont know explicitly find info place avoid bad neighborhood high crime rate anyone know ny live pretty nice low crime issue city couple city within like 2030 minute u pretty terrible place low class higher crime bad neighborhood type stuff buffalo niagara fall though better part worse part comparably looking something similar whatever city end moving decent cost living house price far wealthy 2 house selling give u money well looking somewhere neighborhood like 200k300k nice decent size house maybe even bit needed ofc less would fine looking fixer upper dump need ton work probably something like 23 bedroom 23 bathroom need huge yard ton land actually dont want ton land amenity attraction dont matter much spend majority time house yard dont ever really go much besides normal shopping saying cant cool thing really huge selling point looking move anyway thought would ask reddit good source factual info help would appreciated probably wont moving 23 year would like start narrowing thing least finding good area look help anyone nice area visited nice area info would awesome thanks advance x200b,2024-07-16
663,Kentucky,IDENTIFIER-WEATHER-ATTITUDE,"weather, rain, love",traveling kentucky,planning driving visit partner lexington kentucky metro detroit area mi parent giving warning drive due hurricane milton im little skeptical concern basically whole drive driving ohio lexington pretty close top kentucky saying scared caught mass traffic due people evacuating traffic really backed way ohio comment think really miss partner want see,2024-10-08
671,Kentucky,IDENTIFIER-WEATHER-ATTITUDE,"weather, rain, love",beautiful barren county,taken kayaking yesterday rain sunday love kentucky water way beautiful,2024-11-12
673,Kentucky,IDENTIFIER-WEATHER-ATTITUDE,"weather, rainy, love",state around place kentucky worth visiting around late december partner,im visiting boyfriend christmas decided go travel together around kentuckythe state around he go flow type guy want plan time come love making itinerary figuring plan handdo think yall could tell place preferably around kentucky visited partner cold weather thats worth visiting ill 10 day 45 day spend kentucky take time comment would appreciate bunch thank,2024-11-14
